<?xml version = "1.0" encoding = "utf-8"?>
<book xmlns:xsi = "http://www.w3.org/2001/XMLSchema-instance" xsi:noNamespaceSchemaLocation = "Listing27-03.xsd">  
  <details>    
    <title>JavaScript Unleashed</title>    
    <edition>4th</edition>    
    <publisher>Sams</publisher>    
    <authorList>      
      <author>R. Allen Wyke</author>      
      <author>Jason D. Gilliam</author>    
    </authorList>  
  </details>  
  <available>2002</available>
</book>